page_spanning_verse,page link
,031B
וַיִּקְרָ֤א 'אאא' מֶֽלֶךְ־מִצְרַ֙יִם֙ לַֽמְיַלְּדֹ֔ת וַיֹּ֣אמֶר לָהֶ֔ן מַדּ֥וּעַ עֲשִׂיתֶ֖ן הַדָּבָ֣ר הַזֶּ֑ה וַתְּחַיֶּ֖יןָ אֶת־הַיְלָדִֽים׃,032A
וַתֵּ֣לֶד בֵּ֔ן וַיִּקְרָ֥א אֶת־שְׁמ֖וֹ גֵּרְשֹׁ֑ם כִּ֣י אָמַ֔ר 'אאא' גֵּ֣ר הָיִ֔יתִי בְּאֶ֖רֶץ נָכְרִיָּֽה׃,032B
וָאֹמַ֗ר אַעֲלֶ֣ה אֶתְכֶם֮ מֵעֳנִ֣י מִצְרַיִם֒ אֶל־ 'אאא' אֶ֤רֶץ הַֽכְּנַעֲנִי֙ וְהַ֣חִתִּ֔י וְהָֽאֱמֹרִי֙ וְהַפְּרִזִּ֔י וְהַחִוִּ֖י וְהַיְבוּסִ֑י אֶל־אֶ֛רֶץ זָבַ֥ת חָלָ֖ב וּדְבָֽשׁ׃,033A
,033B
וַיֻּכּ֗וּ שֹֽׁטְרֵי֙ בְּנֵ֣י יִשְׂרָאֵ֔ל 'אאא' אֲשֶׁר־שָׂ֣מוּ עֲלֵהֶ֔ם נֹגְשֵׂ֥י פַרְעֹ֖ה לֵאמֹ֑ר מַדּ֡וּעַ לֹא֩ כִלִּיתֶ֨ם חָקְכֶ֤ם לִלְבֹּן֙ כִּתְמ֣וֹל שִׁלְשֹׁ֔ם גַּם־תְּמ֖וֹל גַּם־הַיּֽוֹם׃,034A
,034B
כִּי֩ יְדַבֵּ֨ר אֲלֵכֶ֤ם פַּרְעֹה֙ לֵאמֹ֔ר תְּנ֥וּ 'אאא' לָכֶ֖ם מוֹפֵ֑ת וְאָמַרְתָּ֣ אֶֽל־אַהֲרֹ֗ן קַ֧ח אֶֽת־מַטְּךָ֛ וְהַשְׁלֵ֥ךְ לִפְנֵֽי־פַרְעֹ֖ה יְהִ֥י לְתַנִּֽין׃,035A
וַיַּֽעֲשׂוּ־כֵ֥ן הֽ͏ַחֲרְטֻמִּ֖ים 'אאא' בְּלָטֵיהֶ֑ם וַיַּעֲל֥וּ אֶת־הַֽצְפַרְדְּעִ֖ים עַל־אֶ֥רֶץ מִצְרָֽיִם׃,035B
וַיֹּ֣אמֶר מֹשֶׁ֗ה הִנֵּ֨ה אָנֹכִ֜י יוֹצֵ֤א מֵֽעִמָּךְ֙ וְהַעְתַּרְתִּ֣י אֶל־יְהוָ֔ה וְסָ֣ר הֶעָרֹ֗ב מִפַּרְעֹ֛ה מֵעֲבָדָ֥יו 'אאא' וּמֵעַמּ֖וֹ מָחָ֑ר רַ֗ק אַל־יֹסֵ֤ף פַּרְעֹה֙ הָתֵ֔ל לְבִלְתִּי֙ שַׁלַּ֣ח אֶת־הָעָ֔ם לִזְבֹּ֖חַ לַֽיהוָֽה׃,036A
וַאֲשֶׁ֥ר לֹא־שָׂ֛ם לִבּ֖וֹ אֶל־דְּבַ֣ר יְהוָ֑ה וַֽיַּעֲזֹ֛ב אֶת־ 'אאא' עֲבָדָ֥יו וְאֶת־מִקְנֵ֖הוּ בַּשָּׂדֶֽה׃,036B
וַיֹּאמְרוּ֩ עַבְדֵ֨י פַרְעֹ֜ה אֵלָ֗יו עַד־מָתַי֙ יִהְיֶ֨ה זֶ֥ה לָ֙נוּ֙ לְמוֹקֵ֔שׁ שַׁלַּח֙ אֶת־הָ֣אֲנָשִׁ֔ים 'אאא' וְיַֽעַבְד֖וּ אֶת־יְהוָ֣ה אֱלֹהֵיהֶ֑ם הֲטֶ֣רֶם תֵּדַ֔ע כִּ֥י אָבְדָ֖ה מִצְרָֽיִם׃,037A
,037B
וְהָיָה֩ הַדָּ֨ם לָכֶ֜ם לְאֹ֗ת 'אאא' עַ֤ל הַבָּתִּים֙ אֲשֶׁ֣ר אַתֶּ֣ם שָׁ֔ם וְרָאִ֙יתִי֙ אֶת־הַדָּ֔ם וּפָסַחְתִּ֖י עֲלֵכֶ֑ם וְלֹֽא־יִֽהְיֶ֨ה בָכֶ֥ם נֶ֙גֶף֙ לְמַשְׁחִ֔ית בְּהַכֹּתִ֖י בְּאֶ֥רֶץ מִצְרָֽיִם׃,038A
וַיִּשָּׂ֥א 'אאא' הָעָ֛ם אֶת־בְּצֵק֖וֹ טֶ֣רֶם יֶחְמָ֑ץ מִשְׁאֲרֹתָ֛ם צְרֻרֹ֥ת בְּשִׂמְלֹתָ֖ם עַל־שִׁכְמָֽם׃,038B
וְהָיָה֩ לְךָ֨ לְא֜וֹת 'אאא' עַל־יָדְךָ֗ וּלְזִכָּרוֹן֙ בֵּ֣ין עֵינֶ֔יךָ לְמַ֗עַן תִּהְיֶ֛ה תּוֹרַ֥ת יְהוָ֖ה בְּפִ֑יךָ כִּ֚י בְּיָ֣ד חֲזָקָ֔ה הוֹצִֽאֲךָ֥ יְהֹוָ֖ה מִמִּצְרָֽיִם׃,039A
וּפַרְעֹ֖ה הִקְרִ֑יב וַיִּשְׂאוּ֩ בְנֵֽי־יִשְׂרָאֵ֨ל אֶת־עֵינֵיהֶ֜ם וְהִנֵּ֥ה מִצְרַ֣יִם ׀ נֹסֵ֣עַ אַחֲרֵיהֶ֗ם 'אאא' וַיִּֽירְאוּ֙ מְאֹ֔ד וַיִּצְעֲק֥וּ בְנֵֽי־יִשְׂרָאֵ֖ל אֶל־יְהוָֽה׃,039B
וַיָּשֻׁ֣בוּ הַמַּ֗יִם וַיְכַסּ֤וּ אֶת־הָרֶ֙כֶב֙ וְאֶת־הַפָּ֣רָשִׁ֔ים לְכֹל֙ חֵ֣יל פַּרְעֹ֔ה 'אאא' הַבָּאִ֥ים אַחֲרֵיהֶ֖ם בַּיָּ֑ם לֹֽא־נִשְׁאַ֥ר בָּהֶ֖ם עַד־אֶחָֽד׃,040A
שָֽׁמְע֥וּ עַמִּ֖ים יִרְגָּז֑וּן חִ֣יל 'אאא' אָחַ֔ז יֹשְׁבֵ֖י פְּלָֽשֶׁת׃,040B
וַיֹּאמְר֨וּ אֲלֵהֶ֜ם בְּנֵ֣י יִשְׂרָאֵ֗ל מִֽי־יִתֵּ֨ן מוּתֵ֤נוּ בְיַד־יְהוָה֙ בְּאֶ֣רֶץ מִצְרַ֔יִם בְּשִׁבְתֵּ֙נוּ֙ עַל־סִ֣יר 'אאא' הַבָּשָׂ֔ר בְּאָכְלֵ֥נוּ לֶ֖חֶם לָשֹׂ֑בַע כִּֽי־הוֹצֵאתֶ֤ם אֹתָ֙נוּ֙ אֶל־הַמִּדְבָּ֣ר הַזֶּ֔ה לְהָמִ֛ית אֶת־כָּל־הַקָּהָ֥ל הַזֶּ֖ה בָּרָעָֽב׃,041A
וַיַּנִּ֤יחוּ אֹתוֹ֙ עַד־הַבֹּ֔קֶר כַּאֲשֶׁ֖ר צִוָּ֣ה מֹשֶׁ֑ה וְלֹ֣א הִבְאִ֔ישׁ וְרִמָּ֖ה לֹא־ 'אאא' הָ֥יְתָה בּֽוֹ׃,041B
וְהָיָ֗ה כַּאֲשֶׁ֨ר יָרִ֥ים מֹשֶׁ֛ה יָד֖וֹ וְגָבַ֣ר יִשְׂרָאֵ֑ל וְכַאֲשֶׁ֥ר 'אאא' יָנִ֛יחַ יָד֖וֹ וְגָבַ֥ר עֲמָלֵֽק׃,042A
עַתָּ֞ה שְׁמַ֤ע בְּקֹלִי֙ אִיעָ֣צְךָ֔ 'אאא' וִיהִ֥י אֱלֹהִ֖ים עִמָּ֑ךְ הֱיֵ֧ה אַתָּ֣ה לָעָ֗ם מ֚וּל הָֽאֱלֹהִ֔ים וְהֵבֵאתָ֥ אַתָּ֛ה אֶת־הַדְּבָרִ֖ים אֶל־הָאֱלֹהִֽים׃,042B
לֹא־תִגַּ֨ע בּ֜וֹ יָ֗ד כִּֽי־סָק֤וֹל יִסָּקֵל֙ אוֹ־יָרֹ֣ה יִיָּרֶ֔ה אִם־ 'אאא' בְּהֵמָ֥ה אִם־אִ֖ישׁ לֹ֣א יִחְיֶ֑ה בִּמְשֹׁךְ֙ הַיֹּבֵ֔ל הֵ֖מָּה יַעֲל֥וּ בָהָֽר׃,043A
לֹ֣֖א 'אאא' תִּֿגְנֹֽ֔ב׃,043B
וְכִֽי־יְרִיבֻ֣ן אֲנָשִׁ֔ים וְהִכָּה־אִישׁ֙ אֶת־ 'אאא' רֵעֵ֔הוּ בְּאֶ֖בֶן א֣וֹ בְאֶגְרֹ֑ף וְלֹ֥א יָמ֖וּת וְנָפַ֥ל לְמִשְׁכָּֽב׃,044A
כִּֽי־יִתֵּן֩ אִ֨ישׁ אֶל־רֵעֵ֜הוּ כֶּ֤סֶף אֽוֹ־כֵלִים֙ 'אאא' לִשְׁמֹ֔ר וְגֻנַּ֖ב מִבֵּ֣ית הָאִ֑ישׁ אִם־יִמָּצֵ֥א הַגַּנָּ֖ב יְשַׁלֵּ֥ם שְׁנָֽיִם׃,044B
כִּֽי־תִרְאֶ֞ה חֲמ֣וֹר 'אאא' שֹׂנַאֲךָ֗ רֹבֵץ֙ תַּ֣חַת מַשָּׂא֔וֹ וְחָדַלְתָּ֖ מֵעֲזֹ֣ב ל֑וֹ עָזֹ֥ב תַּעֲזֹ֖ב עִמּֽוֹ׃,045A
,045B
וְעֹרֹ֨ת אֵילִ֧ם מְאָדָּמִ֛ים 'אאא' וְעֹרֹ֥ת תְּחָשִׁ֖ים וַעֲצֵ֥י שִׁטִּֽים׃,046A
וְשִׁשָּׁ֣ה קָנִ֔ים יֹצְאִ֖ים מִצִּדֶּ֑יהָ שְׁלֹשָׁ֣ה ׀ קְנֵ֣י מְנֹרָ֗ה מִצִּדָּהּ֙ הָאֶחָ֔ד וּשְׁלֹשָׁה֙ קְנֵ֣י מְנֹרָ֔ה מִצִּדָּ֖הּ 'אאא' הַשֵּׁנִֽי׃,046B
,047A
וְעָשִׂ֣יתָ 'אאא' קַרְנֹתָ֗יו עַ֚ל אַרְבַּ֣ע פִּנֹּתָ֔יו מִמֶּ֖נּוּ תִּהְיֶ֣יןָ קַרְנֹתָ֑יו וְצִפִּיתָ֥ אֹת֖וֹ נְחֹֽשֶׁת׃,047B
וְהֵם֙ יִקְח֣וּ אֶת־הַזָּהָ֔ב וְאֶת־הַתְּכֵ֖לֶת וְאֶת־ 'אאא' הָֽאַרְגָּמָ֑ן וְאֶת־תּוֹלַ֥עַת הַשָּׁנִ֖י וְאֶת־הַשֵּֽׁשׁ׃,048A
וְנָתַתָּ֞ אֶל־חֹ֣שֶׁן הַמִּשְׁפָּ֗ט אֶת־הָאוּרִים֙ וְאֶת־הַתֻּמִּ֔ים וְהָיוּ֙ עַל־לֵ֣ב אַהֲרֹ֔ן 'אאא' בְּבֹא֖וֹ לִפְנֵ֣י יְהוָ֑ה וְנָשָׂ֣א אַ֠הֲרֹן אֶת־מִשְׁפַּ֨ט בְּנֵי־יִשְׂרָאֵ֧ל עַל־לִבּ֛וֹ לִפְנֵ֥י יְהוָ֖ה תָּמִֽיד׃,048B
וְלָֽקַחְתָּ֙ מִדַּ֣ם הַפָּ֔ר וְנָתַתָּ֛ה עַל־קַרְנֹ֥ת הַמִּזְבֵּ֖חַ בְּאֶצְבָּעֶ֑ךָ וְאֶת־כָּל־ 'אאא' הַדָּ֣ם תִּשְׁפֹּ֔ךְ אֶל־יְס֖וֹד הַמִּזְבֵּֽחַ׃,049A
וְֽאִם־יִוָּתֵ֞ר מִבְּשַׂ֧ר הַמִּלֻּאִ֛ים וּמִן־הַלֶּ֖חֶם עַד־הַבֹּ֑קֶר וְשָׂרַפְתָּ֤ אֶת־ 'אאא' הַנּוֹתָר֙ בָּאֵ֔שׁ לֹ֥א יֵאָכֵ֖ל כִּי־קֹ֥דֶשׁ הֽוּא׃,049B
זֶ֣ה ׀ יִתְּנ֗וּ כָּל־הָעֹבֵר֙ עַל־הַפְּקֻדִ֔ים מַחֲצִ֥ית הַשֶּׁ֖קֶל בְּשֶׁ֣קֶל הַקֹּ֑דֶשׁ עֶשְׂרִ֤ים גֵּרָה֙ הַשֶּׁ֔קֶל מַחֲצִ֣ית הַשֶּׁ֔קֶל תְּרוּמָ֖ה 'אאא' לֽ͏ַיהוָֽה׃,050A
וָאֲמַלֵּ֥א אֹת֖וֹ ר֣וּחַ אֱלֹהִ֑ים בְּחָכְמָ֛ה וּבִתְבוּנָ֥ה וּבְדַ֖עַת וּבְכָל־ 'אאא' מְלָאכָֽה׃,050B
סָ֣רוּ מַהֵ֗ר מִן־הַדֶּ֙רֶךְ֙ אֲשֶׁ֣ר צִוִּיתִ֔ם עָשׂ֣וּ לָהֶ֔ם עֵ֖גֶל מַסֵּכָ֑ה וַיִּשְׁתַּֽחֲווּ־לוֹ֙ וַיִּזְבְּחוּ־ל֔וֹ וַיֹּ֣אמְר֔וּ אֵ֤לֶּה אֱלֹהֶ֙יךָ֙ יִשְׂרָאֵ֔ל 'אאא' אֲשֶׁ֥ר הֽ͏ֶעֱל֖וּךָ מֵאֶ֥רֶץ מִצְרָֽיִם׃,051A
וְעַתָּ֖ה אִם־תִּשָּׂ֣א חַטָּאתָ֑ם וְאִם־אַ֕יִן מְחֵ֣נִי נָ֔א מִֽסִּפְרְךָ֖ 'אאא' אֲשֶׁ֥ר כָּתָֽבְתָּ׃,051B
וַיֹּ֕אמֶר לֹ֥א תוּכַ֖ל לִרְאֹ֣ת אֶת־ 'אאא' פָּנָ֑י כִּ֛י לֹֽא־יִרְאַ֥נִי הָאָדָ֖ם וָחָֽי׃,052A
,052B
אֶת־הַשֻּׁלְחָ֥ן וְאֶת־בַּדָּ֖יו וְאֶת־כָּל־כֵּלָ֑יו וְאֵ֖ת 'אאא' לֶ֥חֶם הַפָּנִֽים׃,053A
וַיִּקְרָ֣א מֹשֶׁ֗ה אֶל־בְּצַלְאֵל֘ וְאֶל־אָֽהֳלִיאָב֒ וְאֶל֙ כָּל־אִ֣ישׁ חֲכַם־לֵ֔ב אֲשֶׁ֨ר נָתַ֧ן יְהוָ֛ה חָכְמָ֖ה בְּלִבּ֑וֹ כֹּ֚ל אֲשֶׁ֣ר נְשָׂא֣וֹ לִבּ֔וֹ לְקָרְבָ֥ה אֶל־ 'אאא' הַמְּלָאכָ֖ה לַעֲשֹׂ֥ת אֹתָֽהּ׃,053B
וּלְצֶ֧לַע הַמִּשְׁכָּ֛ן הַשֵּׁנִ֖ית לִפְאַ֣ת צָפ֑וֹן 'אאא' עָשָׂ֖ה עֶשְׂרִ֥ים קְרָשִֽׁים׃,054A
וַיַּ֜עַשׂ 'אאא' אֶֽת־הַכֵּלִ֣ים ׀ אֲשֶׁ֣ר עַל־הַשֻּׁלְחָ֗ן אֶת־קְעָרֹתָ֤יו וְאֶת־כַּפֹּתָיו֙ וְאֵת֙ מְנַקִּיֹּתָ֔יו וְאֶת־הַקְּשָׂוֺ֔ת אֲשֶׁ֥ר יֻסַּ֖ךְ בָּהֵ֑ן זָהָ֖ב טָהֽוֹר׃,054B
וְלִפְאַ֤ת צָפוֹן֙ מֵאָ֣ה בָֽאַמָּ֔ה עַמּוּדֵיהֶ֣ם עֶשְׂרִ֔ים וְאַדְנֵיהֶ֥ם עֶשְׂרִ֖ים נְחֹ֑שֶׁת 'אאא' וָוֵ֧י הָֽעַמּוּדִ֛ים וַחֲשֻׁקֵיהֶ֖ם כָּֽסֶף׃,055A
וַֽיְרַקְּע֞וּ אֶת־פַּחֵ֣י הַזָּהָב֮ וְקִצֵּ֣ץ פְּתִילִם֒ לַעֲשׂ֗וֹת בְּת֤וֹךְ 'אאא' הַתְּכֵ֙לֶת֙ וּבְת֣וֹךְ הָֽאַרְגָּמָ֔ן וּבְת֛וֹךְ תּוֹלַ֥עַת הַשָּׁנִ֖י וּבְת֣וֹךְ הַשֵּׁ֑שׁ מַעֲשֵׂ֖ה חֹשֵֽׁב׃,055B
וְֽאֶת־הָאַבְנֵ֞ט שֵׁ֣שׁ מָשְׁזָ֗ר וּתְכֵ֧לֶת וְאַרְגָּמָ֛ן וְתוֹלַ֥עַת שָׁנִ֖י 'אאא' מַעֲשֵׂ֣ה רֹקֵ֑ם כַּאֲשֶׁ֛ר צִוָּ֥ה יְהוָ֖ה אֶת־מֹשֶֽׁה׃,056A
וּמָשַׁחְתָּ֣ 'אאא' אֹתָ֗ם כַּאֲשֶׁ֤ר מָשַׁ֙חְתָּ֙ אֶת־אֲבִיהֶ֔ם וְכִהֲנ֖וּ לִ֑י וְ֠הָיְתָה לִהְיֹ֨ת לָהֶ֧ם מָשְׁחָתָ֛ם לִכְהֻנַּ֥ת עוֹלָ֖ם לְדֹרֹתָֽם׃,056B
,056B
דַּבֵּ֞ר אֶל־בְּנֵ֤י יִשְׂרָאֵל֙ וְאָמַרְתָּ֣ אֲלֵהֶ֔ם אָדָ֗ם כִּֽי־יַקְרִ֥יב מִכֶּ֛ם קָרְבָּ֖ן לַֽיהוָ֑ה מִן־הַבְּהֵמָ֗ה מִן־הַבָּקָר֙ וּמִן־הַצֹּ֔אן תַּקְרִ֖יבוּ 'אאא' אֶת־קָרְבַּנְכֶֽם׃,057A
וְהֵרִ֨ים הַכֹּהֵ֤ן מִן־הַמִּנְחָה֙ אֶת־אַזְכָּ֣רָתָ֔הּ וְהִקְטִ֖יר הַמִּזְבֵּ֑חָה אִשֵּׁ֛ה רֵ֥יחַ 'אאא' נִיחֹ֖חַ לַיהוָֽה׃,057B
,058A
וְסָמַ֤ךְ יָדוֹ֙ עַל־רֹ֣אשׁ הַשָּׂעִ֔יר וְשָׁחַ֣ט 'אאא' אֹת֗וֹ בִּמְק֛וֹם אֲשֶׁר־יִשְׁחַ֥ט אֶת־הָעֹלָ֖ה לִפְנֵ֣י יְהוָ֑ה חַטָּ֖את הֽוּא׃,058B
וְהִזָּ֞ה מִדַּ֤ם הַחַטָּאת֙ עַל־ 'אאא' קִ֣יר הַמִּזְבֵּ֔חַ וְהַנִּשְׁאָ֣ר בַּדָּ֔ם יִמָּצֵ֖ה אֶל־יְס֣וֹד הַמִּזְבֵּ֑חַ חַטָּ֖את הֽוּא׃,059A
וּפָשַׁט֙ אֶת־בְּגָדָ֔יו וְלָבַ֖שׁ בְּגָדִ֣ים אֲחֵרִ֑ים 'אאא' וְהוֹצִ֤יא אֶת־הַדֶּ֙שֶׁן֙ אֶל־מִח֣וּץ לַֽמַּחֲנֶ֔ה אֶל־מָק֖וֹם טָהֽוֹר׃,059B
וְהַ֨כֹּהֵ֔ן 'אאא' הַמַּקְרִ֖יב אֶת־עֹ֣לַת אִ֑ישׁ ע֤וֹר הָֽעֹלָה֙ אֲשֶׁ֣ר הִקְרִ֔יב לַכֹּהֵ֖ן ל֥וֹ יִהְיֶֽה׃,060A
כִּי֩ אֶת־חֲזֵ֨ה הַתְּנוּפָ֜ה וְאֵ֣ת ׀ שׁ֣וֹק הַתְּרוּמָ֗ה לָקַ֙חְתִּי֙ מֵאֵ֣ת בְּנֵֽי־יִשְׂרָאֵ֔ל מִזִּבְחֵ֖י שַׁלְמֵיהֶ֑ם וָאֶתֵּ֣ן 'אאא' אֹ֠תָם לְאַהֲרֹ֨ן הַכֹּהֵ֤ן וּלְבָנָיו֙ לְחָק־עוֹלָ֔ם מֵאֵ֖ת בְּנֵ֥י יִשְׂרָאֵֽל׃,060B
וְאֶת־הַקֶּ֥רֶב וְאֶת־הַכְּרָעַ֖יִם רָחַ֣ץ בַּמָּ֑יִם וַיַּקְטֵר֩ מֹשֶׁ֨ה 'אאא' אֶת־כָּל־הָאַ֜יִל הַמִּזְבֵּ֗חָה עֹלָ֨ה ה֤וּא לְרֵֽיחַ־נִיחֹ֙חַ֙ אִשֶּׁ֥ה הוּא֙ לַיהוָ֔ה כַּאֲשֶׁ֛ר צִוָּ֥ה יְהוָ֖ה אֶת־מֹשֶֽׁה׃,061A
וַיֹּ֣אמֶר מֹשֶׁ֔ה זֶ֧ה הַדָּבָ֛ר 'אאא' אֲשֶׁר־צִוָּ֥ה יְהוָ֖ה תַּעֲשׂ֑וּ וְיֵרָ֥א אֲלֵיכֶ֖ם כְּב֥וֹד יְהוָֽה׃,061B
וַיֹּ֣אמֶר מֹשֶׁ֣ה אֶֽל־אַהֲרֹ֡ן וּלְאֶלְעָזָר֩ וּלְאִֽיתָמָ֨ר ׀ בָּנָ֜יו רֽ͏ָאשֵׁיכֶ֥ם אַל־תִּפְרָ֣עוּ ׀ וּבִגְדֵיכֶ֤ם לֹֽא־תִפְרֹ֙מוּ֙ וְלֹ֣א תָמֻ֔תוּ וְעַ֥ל כָּל־הָעֵדָ֖ה יִקְצֹ֑ף וַאֲחֵיכֶם֙ כָּל־בֵּ֣ית יִשְׂרָאֵ֔ל יִבְכּוּ֙ אֶת־ 'אאא' הַשְּׂרֵפָ֔ה אֲשֶׁ֖ר שָׂרַ֥ף יְהוָֽה׃,062A
כֹּ֣ל אֲשֶׁ֥ר אֵֽין־ל֛וֹ סְנַפִּ֥יר וְקַשְׂקֶ֖שֶׂת בַּמָּ֑יִם 'אאא' שֶׁ֥קֶץ ה֖וּא לָכֶֽם׃,062B
כִּ֣י אֲנִ֣י יְהוָה֮ 'אאא' אֱלֹֽהֵיכֶם֒ וְהִתְקַדִּשְׁתֶּם֙ וִהְיִיתֶ֣ם קְדֹשִׁ֔ים כִּ֥י קָד֖וֹשׁ אָ֑נִי וְלֹ֤א תְטַמְּאוּ֙ אֶת־נַפְשֹׁ֣תֵיכֶ֔ם בְּכָל־הַשֶּׁ֖רֶץ הָרֹמֵ֥שׂ עַל־הָאָֽרֶץ׃,063A
,063B
וְאִישׁ֙ אֽוֹ־אִשָּׁ֔ה כִּֽי־יִהְיֶ֥ה בְעוֹר־בְּשָׂרָ֖ם 'אאא' בֶּהָרֹ֑ת בֶּהָרֹ֖ת לְבָנֹֽת׃,064A
וְצִוָּה֙ הַכֹּהֵ֔ן וְלָקַ֧ח לַמִּטַּהֵ֛ר שְׁתֵּֽי־צִפֳּרִ֥ים חַיּ֖וֹת טְהֹר֑וֹת וְעֵ֣ץ אֶ֔רֶז 'אאא' וּשְׁנִ֥י תוֹלַ֖עַת וְאֵזֹֽב׃,064B
וְשָׁחַט֮ אֶת־כֶּ֣בֶשׂ הָֽאָשָׁם֒ וְלָקַ֤ח הַכֹּהֵן֙ מִדַּ֣ם הָֽאָשָׁ֔ם וְנָתַ֛ן עַל־תְּנ֥וּךְ אֹֽזֶן־הַמִטַּהֵ֖ר הַיְמָנִ֑ית וְעַל־בֹּ֤הֶן יָדוֹ֙ הַיְמָנִ֔ית וְעַל־בֹּ֥הֶן רַגְל֖וֹ 'אאא' הַיְמָנִֽית׃,065A
וְחִטֵּ֣א אֶת־הַבַּ֔יִת בְּדַם֙ הַצִּפּ֔וֹר וּבַמַּ֖יִם הַֽחַיִּ֑ים 'אאא' וּבַצִּפֹּ֣ר הַחַיָּ֗ה וּבְעֵ֥ץ הָאֶ֛רֶז וּבָאֵזֹ֖ב וּבִשְׁנִ֥י הַתּוֹלָֽעַת׃,065B
וְאִשָּׁ֡ה כִּֽי־יָזוּב֩ ז֨וֹב דָּמָ֜הּ יָמִ֣ים 'אאא' רַבִּ֗ים בְּלֹא֙ עֶת־נִדָּתָ֔הּ א֥וֹ כִֽי־תָז֖וּב עַל־נִדָּתָ֑הּ כָּל־יְמֵ֞י ז֣וֹב טֻמְאָתָ֗הּ כִּימֵ֧י נִדָּתָ֛הּ תִּהְיֶ֖ה טְמֵאָ֥ה הִֽוא׃,066A
וְכִפֶּ֣ר עַל־הַקֹּ֗דֶשׁ מִטֻּמְאֹת֙ בְּנֵ֣י 'אאא' יִשְׂרָאֵ֔ל וּמִפִּשְׁעֵיהֶ֖ם לְכָל־חַטֹּאתָ֑ם וְכֵ֤ן יַעֲשֶׂה֙ לְאֹ֣הֶל מוֹעֵ֔ד הַשֹּׁכֵ֣ן אִתָּ֔ם בְּת֖וֹךְ טֻמְאֹתָֽם׃,066B
אִ֥ישׁ אִישׁ֙ מִבֵּ֣ית יִשְׂרָאֵ֔ל אֲשֶׁ֨ר יִשְׁחַ֜ט שׁ֥וֹר אוֹ־כֶ֛שֶׂב אוֹ־עֵ֖ז בַּֽמַּחֲנֶ֑ה 'אאא' א֚וֹ אֲשֶׁ֣ר יִשְׁחַ֔ט מִח֖וּץ לַֽמַּחֲנֶֽה׃,067A
עֶרְוַ֤ת בַּת־בִּנְךָ֙ א֣וֹ בַֽת־ 'אאא' בִּתְּךָ֔ לֹ֥א תְגַלֶּ֖ה עֶרְוָתָ֑ן כִּ֥י עֶרְוָתְךָ֖ הֵֽנָּה׃,067B
,068A
וְאֶל־בְּנֵ֣י יִשְׂרָאֵל֘ תֹּאמַר֒ אִ֣ישׁ אִישׁ֩ מִבְּנֵ֨י יִשְׂרָאֵ֜ל וּמִן־הַגֵּ֣ר ׀ הַגָּ֣ר בְּיִשְׂרָאֵ֗ל אֲשֶׁ֨ר יִתֵּ֧ן מִזַּרְע֛וֹ לַמֹּ֖לֶךְ מ֣וֹת יוּמָ֑ת עַ֥ם הָאָ֖רֶץ 'אאא' יִרְגְּמֻ֥הוּ בָאָֽבֶן׃,068B
וְהִבְדַּלְתֶּ֞ם בֵּֽין־הַבְּהֵמָ֤ה הַטְּהֹרָה֙ לַטְּמֵאָ֔ה וּבֵין־הָע֥וֹף 'אאא' הַטָּמֵ֖א לַטָּהֹ֑ר וְלֹֽא־תְשַׁקְּצ֨וּ אֶת־נַפְשֹֽׁתֵיכֶ֜ם בַּבְּהֵמָ֣ה וּבָע֗וֹף וּבְכֹל֙ אֲשֶׁ֣ר תִּרְמֹ֣שׂ הָֽאֲדָמָ֔ה אֲשֶׁר־הִבְדַּ֥לְתִּי לָכֶ֖ם לְטַמֵּֽא׃,069A
דַּבֵּ֨ר אֶֽל־אַהֲרֹ֜ן וְאֶל־בָּנָ֗יו וְיִנָּֽזְרוּ֙ מִקָּדְשֵׁ֣י בְנֵֽי־יִשְׂרָאֵ֔ל וְלֹ֥א יְחַלְּל֖וּ אֶת־שֵׁ֣ם קָדְשִׁ֑י אֲשֶׁ֨ר הֵ֧ם מַקְדִּשִׁ֛ים לִ֖י אֲנִ֥י 'אאא' יְהוָֽה׃,069B
וְכִֽי־ 'אאא' תִזְבְּח֥וּ זֶֽבַח־תּוֹדָ֖ה לַיהוָ֑ה לִֽרְצֹנְכֶ֖ם תִּזְבָּֽחוּ׃,070A
וּקְרָאתֶ֞ם בְּעֶ֣צֶם ׀ הַיּ֣וֹם הַזֶּ֗ה מִֽקְרָא־קֹ֙דֶשׁ֙ יִהְיֶ֣ה לָכֶ֔ם כָּל־מְלֶ֥אכֶת עֲבֹדָ֖ה לֹ֣א תַעֲשׂ֑וּ 'אאא' חֻקַּ֥ת עוֹלָ֛ם בְּכָל־מוֹשְׁבֹ֥תֵיכֶ֖ם לְדֹרֹֽתֵיכֶֽם׃,070B
,071A
וְ֠הָיְתָה שַׁבַּ֨ת הָאָ֤רֶץ לָכֶם֙ לְאָכְלָ֔ה לְךָ֖ וּלְעַבְדְּךָ֣ וְלַאֲמָתֶ֑ךָ 'אאא' וְלִשְׂכִֽירְךָ֙ וּלְתוֹשָׁ֣בְךָ֔ הַגָּרִ֖ים עִמָּֽךְ׃,071B
וַאֲשֶׁ֤ר יִגְאַל֙ מִן־הַלְוִיִּ֔ם וְיָצָ֧א 'אאא' מִמְכַּר־בַּ֛יִת וְעִ֥יר אֲחֻזָּת֖וֹ בַּיֹּבֵ֑ל כִּ֣י בָתֵּ֞י עָרֵ֣י הַלְוִיִּ֗ם הִ֚וא אֲחֻזָּתָ֔ם בְּת֖וֹךְ בְּנֵ֥י יִשְׂרָאֵֽל׃,072A
,072B
אָז֩ תִּרְצֶ֨ה הָאָ֜רֶץ אֶת־שַׁבְּתֹתֶ֗יהָ כֹּ֚ל יְמֵ֣י הֳשַׁמָּ֔ה 'אאא' וְאַתֶּ֖ם בְּאֶ֣רֶץ אֹיְבֵיכֶ֑ם אָ֚ז תִּשְׁבַּ֣ת הָאָ֔רֶץ וְהִרְצָ֖ת אֶת־שַׁבְּתֹתֶֽיהָ׃,073A
וְאִם֙ כָּל־בְּהֵמָ֣ה טְמֵאָ֔ה אֲ֠שֶׁר לֹא־יַקְרִ֧יבוּ מִמֶּ֛נָּה קָרְבָּ֖ן לַֽיהוָ֑ה וְהֽ͏ֶעֱמִ֥יד אֶת־הַבְּהֵמָ֖ה 'אאא' לִפְנֵ֥י הַכֹּהֵֽן׃,073B
,073B
שְׂא֗וּ אֶת־רֹאשׁ֙ כָּל־עֲדַ֣ת בְּנֵֽי־יִשְׂרָאֵ֔ל לְמִשְׁפְּחֹתָ֖ם לְבֵ֣ית אֲבֹתָ֑ם בְּמִסְפַּ֣ר שֵׁמ֔וֹת 'אאא' כָּל־זָכָ֖ר לְגֻלְגְּלֹתָֽם׃,074A
לִבְנֵ֤י יוֹסֵף֙ לִבְנֵ֣י אֶפְרַ֔יִם תּוֹלְדֹתָ֥ם לְמִשְׁפְּחֹתָ֖ם לְבֵ֣ית אֲבֹתָ֑ם בְּמִסְפַּ֣ר שֵׁמֹ֗ת מִבֶּ֨ן 'אאא' עֶשְׂרִ֤ים שָׁנָה֙ וָמַ֔עְלָה כֹּ֖ל יֹצֵ֥א צָבָֽא׃,074B
וּצְבָא֖וֹ וּפְקֻדֵיהֶ֑ם אַרְבָּעָ֧ה וְשִׁבְעִ֛ים 'אאא' אֶ֖לֶף וְשֵׁ֥שׁ מֵאֽוֹת׃,075A
וְאֵ֛לֶּה תּוֹלְדֹ֥ת אַהֲרֹ֖ן וּמֹשֶׁ֑ה בְּי֗וֹם דִּבֶּ֧ר יְהוָ֛ה 'אאא' אֶת־מֹשֶׁ֖ה בְּהַ֥ר סִינָֽי׃,075B
וּנְשִׂיא֙ נְשִׂיאֵ֣י הַלֵּוִ֔י 'אאא' אֶלְעָזָ֖ר בֶּן־אַהֲרֹ֣ן הַכֹּהֵ֑ן פְּקֻדַּ֕ת שֹׁמְרֵ֖י מִשְׁמֶ֥רֶת הַקֹּֽדֶשׁ׃,076A
וּפָרְשׂ֣וּ עֲלֵיהֶ֗ם בֶּ֚גֶד תּוֹלַ֣עַת 'אאא' שָׁנִ֔י וְכִסּ֣וּ אֹת֔וֹ בְּמִכְסֵ֖ה ע֣וֹר תָּ֑חַשׁ וְשָׂמ֖וּ אֶת־בַּדָּֽיו׃,076B
וְעַמּוּדֵי֩ הֶחָצֵ֨ר סָבִ֜יב וְאַדְנֵיהֶ֗ם וִֽיתֵדֹתָם֙ 'אאא' וּמֵ֣יתְרֵיהֶ֔ם לְכָל־כְּלֵיהֶ֔ם וּלְכֹ֖ל עֲבֹדָתָ֑ם וּבְשֵׁמֹ֣ת תִּפְקְד֔וּ אֶת־כְּלֵ֖י מִשְׁמֶ֥רֶת מַשָּׂאָֽם׃,077A
וְכָל־תְּרוּמָ֞ה לְכָל־קָדְשֵׁ֧י בְנֵי־יִשְׂרָאֵ֛ל אֲשֶׁר־יַקְרִ֥יבוּ לַכֹּהֵ֖ן 'אאא' ל֥וֹ יִהְיֶֽה׃,077B
דַּבֵּר֙ אֶל־בְּנֵ֣י יִשְׂרָאֵ֔ל וְאָמַרְתָּ֖ אֲלֵהֶ֑ם אִ֣ישׁ אֽוֹ־אִשָּׁ֗ה כִּ֤י יַפְלִא֙ לִנְדֹּר֙ נֶ֣דֶר נָזִ֔יר לְהַזִּ֖יר 'אאא' לַֽיהוָֽה׃,078A
וַיָּבִ֨יאוּ אֶת־קָרְבָּנָ֜ם לִפְנֵ֣י יְהוָ֗ה שֵׁשׁ־עֶגְלֹ֥ת צָב֙ וּשְׁנֵ֣י עָשָׂ֣ר 'אאא' בָּקָ֔ר עֲגָלָ֛ה עַל־שְׁנֵ֥י הַנְּשִׂאִ֖ים וְשׁ֣וֹר לְאֶחָ֑ד וַיַּקְרִ֥יבוּ אוֹתָ֖ם לִפְנֵ֥י הַמִּשְׁכָּֽן׃,078B
קָרְבָּנ֞וֹ קַֽעֲרַת־כֶּ֣סֶף אַחַ֗ת שְׁלֹשִׁ֣ים וּמֵאָה֮ מִשְׁקָלָהּ֒ מִזְרָ֤ק אֶחָד֙ כֶּ֔סֶף שִׁבְעִ֥ים שֶׁ֖קֶל בְּשֶׁ֣קֶל הַקֹּ֑דֶשׁ שְׁנֵיהֶ֣ם ׀ מְלֵאִ֗ים סֹ֛לֶת בְּלוּלָ֥ה בַשֶּׁ֖מֶן 'אאא' לְמִנְחָֽה׃,079A
בַּיּוֹם֙ הַתְּשִׁיעִ֔י נָשִׂ֖יא לִבְנֵ֣י 'אאא' בִנְיָמ֑͏ִן אֲבִידָ֖ן בֶּן־גִּדְעֹנִֽי׃,079B
כַּפּ֨וֹת זָהָ֤ב שְׁתֵּים־עֶשְׂרֵה֙ מְלֵאֹ֣ת קְטֹ֔רֶת עֲשָׂרָ֧ה עֲשָׂרָ֛ה הַכַּ֖ף 'אאא' בְּשֶׁ֣קֶל הַקֹּ֑דֶשׁ כָּל־זְהַ֥ב הַכַּפּ֖וֹת עֶשְׂרִ֥ים וּמֵאָֽה׃,080A
וַיַּ֨עַשׂ מֹשֶׁ֧ה וְאַהֲרֹ֛ן וְכָל־עֲדַ֥ת בְּנֵי־יִשְׂרָאֵ֖ל לַלְוִיִּ֑ם כְּ֠כֹל אֲשֶׁר־צִוָּ֨ה יְהוָ֤ה אֶת־מֹשֶׁה֙ לַלְוִיִּ֔ם כֵּן־עָשׂ֥וּ לָהֶ֖ם 'אאא' בְּנֵ֥י יִשְׂרָאֵֽל׃,080B
,081A
,081B
מֵאַ֤יִן לִי֙ בָּשָׂ֔ר לָתֵ֖ת לְכָל־הָעָ֣ם הַזֶּ֑ה כִּֽי־יִבְכּ֤וּ עָלַי֙ לֵאמֹ֔ר תְּנָה־לָּ֥נוּ 'אאא' בָשָׂ֖ר וְנֹאכֵֽלָה׃,082A
הַבָּשָׂ֗ר 'אאא' עוֹדֶ֙נּוּ֙ בֵּ֣ין שִׁנֵּיהֶ֔ם טֶ֖רֶם יִכָּרֵ֑ת וְאַ֤ף יְהוָה֙ חָרָ֣ה בָעָ֔ם וַיַּ֤ךְ יְהוָה֙ בָּעָ֔ם מַכָּ֖ה רַבָּ֥ה מְאֹֽד׃,082B
